{
  "$schema": "https://json-schema.org/draft/2020-12/schema",
  "$id": "https://total-pipe.local/schemas/deck-ir.schema.json",
  "title": "Canonical Deck IR v2",
  "type": "object",
  "additionalProperties": false,
  "required": ["schema_version", "deck_id", "theme", "assets", "slides"],
  "properties": {
    "schema_version": {"const": "2.0"},
    "deck_id": {"type": "string", "minLength": 1},
    "presentation": {
      "type": "object",
      "additionalProperties": false,
      "properties": {
        "frame_variant": {"enum": ["default", "spacious"]},
        "bullet_style": {
          "enum": ["bullet", "square", "open_square", "diamond", "arrow", "check", "dash"],
          "description": "Native list marker used on every list page of this deck."
        },
        "list_gap": {
          "type": "number", "minimum": 0.1, "maximum": 1.5,
          "description": "Space between list items as a fraction of the line height (default 0.45)."
        }
      }
    },
    "theme": {
      "type": "object",
      "additionalProperties": false,
      "required": ["font_family", "font_file", "bold_font_file"],
      "properties": {
        "font_family": {"type": "string", "minLength": 1},
        "font_file": {"type": "string", "minLength": 1},
        "bold_font_file": {"type": "string", "minLength": 1},
        "foreground": {"type": "string", "pattern": "^#[0-9A-Fa-f]{6}$"},
        "background": {"type": "string", "pattern": "^#[0-9A-Fa-f]{6}$"},
        "accent": {"type": "string", "pattern": "^#[0-9A-Fa-f]{6}$",
                   "description": "List markers, step badges and emphasis. Defaults to #C2410C."},
        "background_image": {"type": "string", "minLength": 1,
                             "description": "Full-bleed picture drawn under every slide, relative to deck_ir.json. Its contrast against the text colour is measured before the build."}
      }
    },
    "assets": {
      "type": "object",
      "additionalProperties": {
        "type": "object",
        "additionalProperties": false,
        "required": ["path"],
        "properties": {
          "path": {"type": "string", "minLength": 1},
          "source_figure": {"type": "string", "pattern": "^[1-9][0-9]*[a-z]?$"},
          "origin": {"enum": ["paper", "generated"],
                     "description": "paper (default) = cropped from the paper; generated = drawn by the pipeline."},
          "generator": {"type": "string", "minLength": 1,
                        "description": "Required when origin is generated: tool and version, e.g. make_schematic.py/flow."}
        }
      }
    },
    "slides": {
      "type": "array",
      "minItems": 1,
      "items": {"$ref": "#/$defs/slide"}
    }
  },
  "$defs": {
    "graphic": {
      "type": "object",
      "additionalProperties": false,
      "required": ["id", "type", "direction", "nodes", "edges"],
      "properties": {
        "id": {"type": "string", "pattern": "^[A-Za-z0-9_-]{1,64}$"},
        "type": {"enum": ["process", "dag"]},
        "direction": {"const": "horizontal"},
        "nodes": {
          "type": "array", "minItems": 1, "maxItems": 16,
          "items": {
            "type": "object", "additionalProperties": false,
            "required": ["id", "title"],
            "properties": {
              "id": {"type": "string", "pattern": "^[A-Za-z0-9_-]{1,64}$"},
              "shape": {"enum": ["rect", "rounded-rect", "ellipse", "diamond", "hexagon"]},
              "title": {"type": "string", "minLength": 1, "maxLength": 80, "pattern": "\\S"},
              "body": {"type": "string", "maxLength": 180}
            }
          }
        },
        "edges": {
          "type": "array", "maxItems": 64,
          "items": {
            "type": "object", "additionalProperties": false,
            "required": ["from", "to"],
            "properties": {
              "from": {"type": "string", "pattern": "^[A-Za-z0-9_-]{1,64}$"},
              "to": {"type": "string", "pattern": "^[A-Za-z0-9_-]{1,64}$"},
              "kind": {"const": "arrow"}
            }
          }
        }
      },
      "allOf": [{
        "if": {"properties": {"type": {"const": "process"}}},
        "then": {"properties": {"nodes": {"minItems": 3, "maxItems": 4},
                                "edges": {"minItems": 2, "maxItems": 3}}}
      }]
    },
    "slide": {
      "type": "object",
      "additionalProperties": false,
      "required": ["id", "semantic", "composition", "presentation"],
      "properties": {
        "id": {"type": "string", "minLength": 1},
        "semantic": {
          "type": "object",
          "additionalProperties": false,
          "required": ["title", "purpose", "takeaway", "evidence_refs", "caveats", "speaker_notes"],
          "properties": {
            "title": {"type": "string", "minLength": 1, "maxLength": 120},
            "purpose": {"type": "string", "minLength": 1},
            "takeaway": {"type": "string", "minLength": 1, "maxLength": 180},
            "evidence_refs": {"type": "array", "items": {"type": "string"}},
            "caveats": {"type": "array", "items": {"type": "string"}},
            "run_notes": {"type": "array", "items": {"type": "string"}},
            "speaker_notes": {"type": "string", "minLength": 1}
          }
        },
        "composition": {
          "type": "object",
          "additionalProperties": false,
          "required": ["archetype", "blocks", "figure_refs"],
          "properties": {
            "archetype": {
              "enum": [
                "native-graphic", "cover-hero", "metric-comparison", "process-flow", "figure-parameters",
                "hero-dual-evidence", "evidence-hypothesis", "dual-demonstration",
                "three-limitations", "three-conclusions"
              ]
            },
            "graphics": {
              "type": "array", "maxItems": 1,
              "items": {"$ref": "#/$defs/graphic"},
              "description": "One editable process or DAG. Optional on process-flow and figure-parameters alongside blocks and source figures; required on native-graphic. Geometry is compiler-owned."
            },
            "blocks": {
              "type": "array",
              "items": {
                "type": "object",
                "additionalProperties": false,
                "required": ["id", "component", "text"],
                "properties": {
                  "id": {"type": "string", "minLength": 1},
                  "component": {
                    "enum": [
                      "body", "metric", "parameter", "process-step", "direct-evidence",
                      "hypothesis", "limitation", "conclusion", "callout", "comparison",
                      "definition", "observation", "method", "result", "question", "source", "caveat", "formula"
                    ]
                  },
                  "label": {"type": "string"},
                  "text": {"type": "string", "minLength": 1, "maxLength": 600},
                  "text_flow": {"enum": ["auto", "plain", "distributed_arrow_list"]},
                  "anchor": {"type": "string", "minLength": 1,
                             "description": "Formula only: id of the block this equation explains. The compiler places an unlabelled equation under the block above it and never as a peer row."}
                }
              }
            },
            "visual_intent": {
              "type": "object",
              "additionalProperties": false,
              "required": ["relation", "members", "orientation", "preserve_order"],
              "properties": {
                "relation": {"const": "process"},
                "members": {"type": "array", "minItems": 4, "maxItems": 4, "uniqueItems": true,
                  "items": {"type": "string", "minLength": 1}},
                "orientation": {"const": "vertical"},
                "preserve_order": {"const": true},
                "emphasis": {"type": "string", "minLength": 1}
              }
            },
            "figure_refs": {
              "type": "array",
              "items": {
                "type": "object",
                "additionalProperties": false,
                "required": ["asset_id", "caption"],
                "properties": {
                  "asset_id": {"type": "string", "minLength": 1},
                  "caption": {"type": "string", "maxLength": 180},
                  "alt": {"type": "string"},
                  "panel_count": {"type": "integer", "minimum": 1, "maximum": 6},
                  "source_figure": {"type": "string", "pattern": "^[1-9][0-9]*[a-z]?$",
                                    "description": "Paper figure id. Required for paper assets, forbidden for generated ones."},
                  "min_panel_extent": {"type": "number", "minimum": 140, "maximum": 500},
                  "caption_height": {"type": "number", "minimum": 24, "maximum": 96},
                  "caption_font_size": {"type": "number", "minimum": 12, "maximum": 28},
                  "caption_font_floor": {"type": "number", "minimum": 10, "maximum": 28}
                }
              }
            }
          },
          "allOf": [{
            "if": {"properties": {"archetype": {"const": "native-graphic"}}},
            "then": {
              "required": ["graphics"],
              "properties": {"graphics": {"minItems": 1}, "blocks": {"maxItems": 0},
                             "figure_refs": {"maxItems": 0}}
            },
            "else": {
              "if": {"properties": {"archetype": {"enum": ["process-flow", "figure-parameters"]}}},
              "else": {"properties": {"graphics": {"maxItems": 0}}}
            }
          }, {
            "if": {"required": ["graphics"], "properties": {"graphics": {"minItems": 1}}},
            "then": {"not": {"required": ["visual_intent"]}}
          }]
        },
        "presentation": {
          "type": "object",
          "additionalProperties": false,
          "properties": {
            "variant": {"enum": ["default", "spacious"]},
            "theme_tokens": {"type": "object"},
            "component_variants": {"type": "object"},
            "optional_overrides": {"type": "object", "maxProperties": 0}
          }
        }
      }
    }
  }
}
